"id","de","en","desc_de","desc_en"
1,"[Ortstyp]","[Place Type]","Grobe Einordnung des beschriebenen Ortes","General definition of the place described"
2,"[Bautechnische Spezifikationen]","[Place Technique]","Hafenterminologie bautechnisch spezifiziert","Harbour terminology in matters of construction/building technique"
3,"[Hafentopographie]","[Place Topography]","Topographische Lage des Hafens","Topographic position of the harbour"
4,"[Hafeninfrastruktur]","[Place Infrastructure]","Hafentechnische und ergänzende Einrichtungen","Infrastructure for harbour operation and additional facilities"
5,"[Hafenverwendungszweck]","[Place Function]","Verwendungszweck des Hafens","Function and purpose of the harbour"
6,"[Transportgüter und Funde]","[Goods and Finds]","Spezifische nachgewiesene Transportgüter und andere spezifische Funde und Materialgruppen","Proof of specific transported goods and other specific finds and groups of materials"
7,"[Hafen- und schifffahrtsspezifische Handlungen]","[Actors Activities]","Hafen - und schifffahrtsspezifische Handlungen und Ereignisse sowie spezifische Nutzergruppen","Harbour - and navigation-specific actions and events, as well as specific user groups"
8,"[Bedeutung des Hafens]","[Place Significance]","Individuelle Experteneinschätzung zur hierarchischen Einordnung und Bedeutung des Hafens bezüglich der Reichweite seiner Bedeutung, der Lage im Hafennetzwerk, der Nutzungsfrequenz und -dauer, des generellen baulichen Aufwandes sowie der räumlichen Verbindung zu Produktions- und Konsumorten sowie Landwegen;","Individual expert evaluation concerning the hierarchical order and importance of the harbour revolves around the spatial extent of his connections, his position in the harbour network, the frequency and duration of his use, the general constructive effort, the spatial connection to sites of production and consumption, as well as terrestrial routes"
